Questions,num_words,num_characters,num_misspelled,bin_start_interrogative,bin_end_qmark,num_interrogative,bin_start_small,avg_word_sentence,num_sentences,bin_url,readability_score,num_punctuations,bin_taboo,grammar_check,Average IDF,Entropy,Polarity,Subjectivity
"the formula for the area of a trapezoid is a=1/2h(b1 b2). express b1 in term of a, h. and b2. hte area of a trapezoid is 60 square feet, its height is 6 ft adn one base is 12 ft. find the number of feet in the other base.<br />",53,178,8,0,0,0,1,8.833333333,6,0,-2.438993711,11,0,0,-3.48212758,0.227934605,-0.4625,0.6875
Fonction politique de Paris,4,24,3,0,0,0,0,4,1,0,8.83,0,0,0,-4.630487994,0.012904401,0,0
The Hobbit ONLY!!<br /> List 10 questions for the hobbit! No online found ones!,14,66,2,0,0,0,0,4.666666667,3,0,0.752619048,6,0,0,-4.828313737,0.022211083,0,0
The function f(t)= -5t squared  plus 20t  plus 60 models the approximate height of an object t seconds after it is launched. How many seconds does it take the object to hit the ground?,35,149,2,0,1,1,0,17.5,2,0,6.563714286,5,0,0,-3.16389369,0.228092644,0.05,0.55
Differences between heavily prescribed glasses and low prescription? ,8,61,0,0,0,0,0,4,2,0,15.895,1,0,1,-6.753604599,0.003364928,-0.1,0.4
oracií€Œ_n con and y the,6,20,1,0,0,0,1,6,1,0,-5.87,0,0,0,-5.80914299,0.002544874,0,0
A quadratic equation of the form 0 = ax2   bx   c has a discriminant value of 0. How many real number solutions does the equation have?,25,106,1,0,1,1,0,12.5,2,0,4.2252,2,0,0,-3.669076827,0.122240273,0.35,0.4
"nevrmind , thats a silly question<br />",6,33,2,0,0,0,1,6,1,0,4.335,3,0,0,-5.349610661,0.007241221,-0.5,0.875
"im the following sentence, identify the part of speech of the italized word",13,63,2,0,0,0,1,13,1,0,7.533076923,1,0,0,-4.166915255,0.04147196,0,0.1
Witch one of the following sentences contains a Coordinating conjunction ,10,63,0,0,0,0,0,10,1,0,13.243,0,0,1,-4.238544911,0.032295688,0,0.1
_____ Health insurance coverage pays for at least part of the hospital costs and fees A.PPO B.HMO C.Basic D.Major medical,23,102,1,0,0,0,0,4.6,5,0,-0.085217391,4,0,0,-5.645513567,0.02114771,-0.15,0.2
OMG Look at your profile Page its so Bad,9,32,1,0,0,0,0,9,1,0,-0.183333333,0,0,1,-5.80914299,0.006358917,-0.7,0.666666667
choose the most precise measurement.<br /> a-12mL<br /> b-2.56mL<br /> c-15.20mL<br /> d-25L,19,80,8,0,0,0,1,4.75,4,0,-3.933421053,15,0,0,-6.081076706,0.006708819,0.45,0.65
How to say cytryna in polish birenik moga not jedencza,10,45,4,1,0,1,0,10,1,0,4.765,0,0,0,-5.991464547,0.006218317,0,0
BRANIEST ANSWER HELLLLLLLLLLLLLP<br /> Can someone help me in these lessons i dont understand tehm if u can message me please,21,105,5,0,0,0,0,21,1,0,11.94714286,2,0,0,-4.330066896,0.052105332,0,0
Type hey for points hurry people's ,6,29,0,0,0,0,0,6,1,0,4.335,0,0,1,-3.164150925,0.087696446,0,0
Explain the Penis Material?,4,24,0,0,1,0,0,4,1,0,7.6525,1,1,1,-5.173154224,0.006525745,0,0
Why am I doing this? ,5,16,0,1,0,1,0,2.5,2,0,-6.05,1,0,1,-9,0,0,0
"Question 1: Mt. Everest is considered the tallest mountain in the world at 8,848 meters above sea level.  In fact, the largest mountain in the world is Mauna Loa, in Hawaií¢ä‰åä‹¢i. Mauna Loa rises 4,170 meters from sea level to the top of the summit, but its base is deep under water.  The base of the mountain is at í¢Êäó»5,000 meters. A probe is dropped 7,500 meters straight down into Mauna Loa from its summit.<br /> At what height is the probe, relative to sea level?   ___________  meters<br /><br /> How far is the probe from the base of the volcano? _____________ meters<br /><br /> Question 2: It takes 40 units of maple sap to produce one unit of maple syrup.  Jane and her family are bottling maple syrup in 20 oz. bottles.  She notices that they add about 2 oz. of air every time they fill a bottle, to avoid overfill.  <br /> How much maple sap did they need to collect to fill 15 bottles? __________ oz.<br /><br /> How much less maple sap did they need than if they would have filled each bottle ",188,818,15,0,0,4,0,11.75,16,0,2.458244681,40,0,0,-4.505620915,0.386896914,-0.101709402,0.527350427
How much time will pass before they are aligned again? ,10,45,0,1,0,1,0,5,2,0,1.794,1,0,1,-4.342805922,0.017971983,0.2,0.2
P=110t   25 what car position three amd a half hours ,11,41,2,0,0,1,0,11,1,0,1.197272727,0,0,0,-4.753090316,0.025395343,-0.166666667,0.166666667
HELP WITH FOLLOWING QUESTIONS.,4,27,0,0,0,0,0,4,1,0,11.185,1,0,1,-3.324236341,0.032699891,0,0.1
Darron uses a family ,4,17,1,0,0,0,0,4,1,0,0.5875,0,0,0,-4.96184513,0.007754512,0,0
help jill figure out her score in some games she played with friends. her score is always in between the lowest score and the highest score shown. use only the cards below to determine her scores.          4 1/2               a.                         5 3 1/3               b.                       3 2/3 3 1/2               c.                       3 3/4 4 2/3              d.                        5 2 3/4              e.                       3 1/8 ?                     f.                          ?  Jill scores  3 4 3/4 4 5/6 3 2/3 3 1/2 4 2/3 only use these numbers once,91,263,1,0,0,0,1,7.583333333,12,0,-5.268113553,11,0,0,-3.343614815,0.54835811,0,1
"Let f(x)=4-x^2, g(x)=2-x",10,22,0,0,0,0,0,10,1,0,-10.778,7,0,1,-1.921661094,0.33824444,0,0
which of the following prewriting activities ca help you generate ideas for an essay written for class.,17,87,1,0,0,0,1,17,1,0,10.89705882,1,0,0,-4.240527072,0.046128984,0,0.1
"Mr Johnson is currently four times as ols as his son, David.  If Mr. Johnson was 46 years old two years ago, how old is David now?  ",27,103,1,0,0,1,0,6.75,4,0,-0.959444444,5,0,0,-4.95393995,0.04748137,0.066666667,0.266666667
I have none?<br /> Jxjdjdjdjdjdjdjdhdhdjdjdjdhdhdhdhdhd<br />,6,56,3,0,0,0,0,3,2,0,18.535,5,0,0,-6.214608098,0.001798946,0,0
cuales son las rejoined naturales,5,29,2,0,0,0,1,5,1,0,8.388,0,0,0,-6.319968614,0.004071582,0,0
is musa from winx asian,5,19,3,0,0,0,1,5,1,0,-1.032,0,0,0,-6.396929655,0.002315336,0,0
which of the following is true about the poas volcano national park,12,56,1,0,0,0,1,12,1,0,6.55,0,0,0,-4.368781408,0.024542829,0.175,0.375
why does the author refer to the definition of idol from ancient history,13,60,0,1,0,1,1,13,1,0,6.808461538,0,0,0,-5.866301404,0.007310609,0,0
why did aisha/layla from winx club enchantix outfit color change after bloom earned her enchantix,16,83,5,1,0,1,1,16,1,0,10.70875,0,0,0,-5.626821434,0.014716546,0,0
what can you infer about the author of the passage,10,41,0,1,0,1,1,10,1,0,2.881,0,0,0,-5.80914299,0.003853318,0,0
Revolutionary war soldier 7 letters and has the word red in it?,12,52,0,0,1,0,0,12,1,0,4.5875,1,0,1,-4.982464417,0.017750099,0,0
what do you think about muslim,6,25,1,1,0,1,1,6,1,0,1.195,0,0,0,-4.96184513,0.005323138,0,0
what do you think about muslims,6,26,1,1,0,1,1,6,1,0,1.98,0,0,0,-5.035953102,0.004901224,0,0
I know this website is not for this stuff.  But I'm out of options. I'm 15 and there is this guys that I've known for months now and I really like him. I think he knows that I like him and I think he might like me to but I just don't know if I should tell him how I feel or not. Should I tell him how I feel??,70,239,0,0,1,2,0,14,5,0,1.247571429,6,0,0,-3.755324554,0.191072551,0.2,0.2
I know this website is not for this stuff.  But I'm out of options. I'm 15 and there is this guy that I've known for months now and I really like him. I think he knows that I like him and I think he might like me to but I just don't know if I should tell him how I feel or not. Should I tell him how I feel??,70,238,0,0,1,2,0,14,5,0,1.180285714,6,0,1,-3.75838266,0.19025461,0.2,0.2
"Kristin lives in Alaska. She drives a car with a 12-gallon fuel tank. When Kristin fills her empty gas tank in Alaska, she has to pay a federal gasoline<br /> tax of $.18 (or 18 cents) per gallon, plus a state gas tax of 8 cents ($.08) per gallon. Her taxes paid for a gallon of gas equal 26 cents. <br /><br /> You can calculate the percentage of a purchase that goes to taxes by dividing the tax amount by the total sale price. If Kristin buys gas at $3.69 per gallon, which includes all taxes, what percentage of the price is the state tax? What percentage is the federal tax?",113,468,3,0,1,3,0,11.3,10,0,2.434778761,25,0,0,-3.504707758,0.545505667,-0.033333333,0.5
"Kristin lives in Alaska. She drives a car with a 12-gallon fuel tank. When Kristin fills her empty gas tank in Alaska, she has to pay a federal gasoline<br /> tax of $.18 (or 18 cents) per gallon, plus a state gas tax of 8 cents ($.08) per gallon. Her taxes paid for a gallon of gas equal 26 cents. <br /><br /> You can calculate the percentage of a purchase that goes to taxes by dividing the tax amount by the total sale price. If Kristin buys gas at $3.69 per gallon, which includes all taxes, what percentage of the price is the state tax? What percentage is the federal tax?",113,468,3,0,1,3,0,11.3,10,0,2.434778761,25,0,0,-3.504707758,0.545505667,-0.033333333,0.5
please explain show work,4,21,0,0,0,0,1,4,1,0,5.2975,0,0,0,-3.851398384,0.02844165,0,0
which statement best describes animals that are heterotrophs,8,53,1,0,0,0,1,8,1,0,13.77375,0,0,0,-4.546901278,0.019120519,1,0.3
use cubes to show how to add I turtle to 5 turtles Draw the cubes,15,51,0,0,0,1,1,15,1,0,2.084,0,0,0,-4.572380363,0.032029194,0,0
which of the following is an example of an abiotic factor?,11,48,1,0,1,0,1,11,1,0,4.194545455,1,0,0,-3.989984547,0.02384436,0,0.1
Essay on A True Hero is a Unifying Force in a Diverse Society,13,49,0,0,0,0,0,13,1,0,2.823076923,0,0,1,-4.258545578,0.035015299,0.35,0.65
Jordan interviewed her 30 classmates on whether or not they played video games and if they drink soda. She displayed her results in the two-way table shown. Which statement is true?<br /><br /><br /> A)  A classmate who drinks soda is more likely to play video games. <br /> Eliminate<br /><br /> B) A classmate who plays video games is not as likely to drink soda. <br /><br /> C) About the same percentage of students play video games as those who don't drink soda. <br /><br /> D) It is twice as likely that a student doesn't play video games nor drink soda as one who plays video games and drinks soda. <br />,112,498,11,0,0,4,0,14,8,0,4.620267857,34,0,0,-3.202218457,0.612220338,0.1,0.725
Charlie has 3 sweets. He gave 1 sweet to Tom. How many sweets does Charlie have now?,17,68,0,0,1,1,0,5.666666667,3,0,-0.587843137,3,0,1,-3.729701449,0.068187533,0.425,0.575
9-8= ? cevabí‹Œ± nedir?,4,20,2,0,1,0,0,2,2,0,-6.3,3,0,0,-6.907755279,0.001471507,0,0
fie numerele 2ab si 1111001(2). Aflati valoarea de adevar a propozitiei 2ab mai mic sau egal 1111001(2)<br />                                                                                                                            -,20,93,14,0,0,0,1,10,2,0,3.352,8,0,0,-2.571317417,0.378653965,0,0
Bonjour je doit ecrire un paragraphe sur le Texas (100 í€Œæ 150 mots) pouvez vous m'aidez.<br /> PS: C'est en anglais<br /><br /> Merci d'avance,24,120,16,0,0,0,0,12,2,0,4.78375,9,0,0,-3.101886755,0.290121107,0,0
what does a shotgun shell have that a cartridge does not,11,46,0,1,0,1,1,11,1,0,3.766363636,0,0,0,-6.620073207,0.001893421,0,0
"tea,rubber,coffee plantation in kerala",6,35,1,0,0,0,1,6,1,0,7.475,2,0,0,-6.907755279,0.001471507,0,0
Sa se calculeze constanta elastica echivalenta a sistemului  de resorturi cunoscí€Œ¢nd K1=K2=K3=K4=20N/m,18,92,16,0,0,0,0,18,1,0,9.288333333,0,0,0,-5.298317367,0.019679582,0,0
by means of substitution z= (2x-1)(dy/dx) how do i express the differential eqn (2x-1)(d2y/dx2) = 2(1-(dy/dx)) as a differntial eqn involving z and x,32,126,11,0,0,1,1,32,1,0,10.171875,15,0,0,-1.908148316,0.943889105,-0.75,1
Compare and contrast sexual reproduction in plants and animals ,9,54,0,0,0,0,0,9,1,0,11.33,0,0,1,-5.403677882,0.011009025,0.5,0.833333333
"15 Which statement describes the particles of an ideal gas, based on the kinetic molecular theory?<br /> (1) The motion of the gas particles is orderly and circular.<br /> (2) The gas particles have no attractive forces between them.<br /> (3) The gas particles are larger than the disí‰Œ_tances separating them.<br /> (4) As the gas particles collide, the total energy of the system decreases.",66,330,5,0,0,0,0,13.2,5,0,6.507727273,23,0,0,-2.516469319,0.756307189,0.125,0.8125
a card is chosen at random from a pack of cards what is the probability to choose a diamond,19,73,0,0,0,1,1,19,1,0,6.166315789,0,0,0,-5.942674383,0.008835204,-0.5,0.5
2. Uma bola de 200g í€Œ© chutada por um jogador e sai com uma velocidade de 10m/s. Calcule a energia ciní€Œ©tica da bola assim que í€Œ© chutada.,27,118,19,0,0,0,0,9,3,0,0.863333333,3,0,0,-4.689388265,0.074481943,0,0
How much do 6 liters  of petrol cost at 84p per litre,12,41,2,1,0,1,0,12,1,0,0.6625,0,0,0,-4.580477573,0.028609054,0.2,0.2
potrzebije bardzo krutko streszczenia akademia pana kleksa,7,52,7,0,0,0,1,7,1,0,17.05857143,0,0,0,-6.907755279,0.003433516,0,0
"If 1 in of cheese is shared between 4 people,how much will they each have?",16,60,0,0,1,1,0,16,1,0,3.64375,2,0,0,-3.421400089,0.055931156,0.2,0.2
Che tempo í€ŒÂ scomparire<br />,4,27,2,0,0,0,0,4,1,0,4.12,2,0,0,-6.907755279,0.001962009,0,0
Hola me pueden decir en que continente se encuentra Puerto Rico,11,53,7,0,0,0,0,11,1,0,6.763636364,0,0,0,-5.449140256,0.016940274,0,0
cual es el paí€Œ_s donde esta Mismo?,8,30,4,0,1,0,1,8,1,0,-2.71125,1,0,0,-6.020452084,0.007241135,0,0
Trouver deux nombres dont la somme vaut 1776 et dont la division euclidienne du plus grand des deux par le plus petit í€Œæ pour quotient 6 et pour reste 19,29,126,14,0,0,0,0,29,1,0,12.88448276,0,0,0,-5.28507214,0.058413395,0.5,1
"describe the flow of blood through the body, including through each of the four chambers of the heart.explain how the blood changes as it moves through various locations in the body.",32,152,0,0,0,1,1,16,2,0,8.5009375,3,0,0,-4.992935717,0.036773919,0,0.5
In which of the following sentences is the underlined word a conc,12,54,1,0,0,0,0,12,1,0,5.765,0,0,0,-4.186459851,0.024707971,0,0.1
jak uwazasz ktore zabawki sprawiaja wspolczesnym dzieciom wiecej radosci -zrobione wíƒäó_asnorí‹ä‹¢cznie przez artystow ludowych czy wyprodukowane w wilkich fabrykach ? uzasadnij swoja opinie przynajmniej w trzeh zdaniach,28,195,25,0,0,0,1,14,2,0,16.35321429,2,0,0,-6.381662183,0.019462276,0,0
In which of the following sentence is the underlined word a concrete noun,13,61,0,0,0,0,0,13,1,0,7.170769231,0,0,1,-4.12480377,0.031564406,0.075,0.2
determine combienlui coutera l'achat de rouleau necssaires,7,52,6,0,0,0,1,7,1,0,17.05857143,0,0,0,-3.107781777,0.114590542,0,0
1990yilinda yasi dogum tarihinin son iki basamagina esit olan biri 2010yilinda kac yasinda olur seí€Œ_enek a.75b.73.c.68.d.65,23,110,16,0,0,0,0,3.285714286,7,0,0.691118012,6,0,0,-6.589301548,0.010285048,0,0
jessies bus ride is to school is 5 minutes more than 2/3 the time of roberts bus ride. which graph shows the possible times of jessies and roberts bus ride?,31,127,4,0,1,0,1,15.5,2,0,5.16,2,0,0,-4.848247952,0.054613054,0.25,0.75
essay on a true hero is a unfiying force in a diverse society,13,49,1,0,0,0,1,13,1,0,2.823076923,0,0,0,-4.27895445,0.034240057,0.35,0.65
"consideration, flexibility, tolerance, and honest communication",6,58,0,0,0,0,1,6,1,0,24.745,3,0,0,-5.952243834,0.005733352,0.6,0.9
"consideration, flexibility,  tolerance, and honest communication ",6,58,0,0,0,0,1,6,1,0,24.745,3,0,0,-5.952243834,0.005733352,0.6,0.9
essay on a true hero is a unfiying force in a diverse society,13,49,1,0,0,0,1,13,1,0,2.823076923,0,0,0,-4.27895445,0.034240057,0.35,0.65
essay on welfare of my society depends on my well being,11,45,0,0,0,0,1,11,1,0,3.338181818,0,0,0,-4.546901278,0.019409768,0,0
essay on welfare of my society depends on my well being society,12,52,0,0,0,0,1,12,1,0,4.98,0,0,0,-4.494822129,0.024448836,0,0
<br /><br /><br /><br /><br /><br /><br /><br /><br /><br /><br /><br /><br /><br /><br /><br /><br /><br /><br /><br /><br /><br /><br /><br /><br /><br /><br /><br /><br /><br /><br /><br /><br /><br /><br /><br /><br /><br /><br /><br /><br /><br /><br /><br /><br /><br /><br /><br /><br /><br /><br /><br /><br /><br /><br /><br /><br /><br /><br /><br /><br /><br /><br /><br /><br /><br /><br /><br /><br /><br /><br /><br /><br /><br /><br /><br /><br /><br /><br /><br /><br /><br /><br /><br /><br /><br /><br /><br /><br /><br /><br /><br /><br /><br /><br /><br /><br /><br /><br /><br /><br /><br /><br /><br /><br /><br /><br /><br /><br /><br /><br /><br /><br /><br /><br /><br /><br /><br /><br /><br /><br /><br /><br /><br /><br /><br /><br /><br /><br /><br /><br /><br /><br /><br /><br /><br /><br /><br /><br /><br /><br /><br /><br /><br /><br /><br /><br /><br /><br /><br /><br /><br /><br /><br /><br /><br /><br /><br /><br /><br /><br /><br /><br /><br /><br /><br /><br ,167,833,167,0,0,0,0,167,1,0,71.49,333,0,0,-5.298317367,0.004013383,0,0
"para encontrar la pendiente en una grí€Œçfica con dos puntos 6,3 como es ",15,60,6,0,0,0,1,15,1,0,3.34,1,0,0,-5.298317367,0.025039048,0,0
"describe the flow of blood through the body, including through each of the four chambers of the heart.explain how the blood changes as it moves through various locations in the body.",32,152,0,0,0,1,1,16,2,0,8.5009375,3,0,0,-4.992935717,0.036773919,0,0.5
what does Douglass yearn for above all else?,8,37,0,1,1,1,1,8,1,0,3.765,1,0,0,-6.907755279,0.001471507,0,0.1
What is your name ?                                    :),4,17,0,1,0,1,0,2,2,0,-3.945,2,0,0,-1.836756835,0.100811813,0.5,1
which statement best explains why foreign invasions of ancient India succeeded,11,68,0,0,0,1,1,11,1,0,13.18636364,0,0,0,-5.035953102,0.019429024,0.4375,0.2125
"A soccer team played 160 games and won 65 percent of them, how many games did they win break down<br />",21,83,1,0,0,1,0,21,1,0,6.788571429,3,0,0,-4.839742433,0.030539136,0.65,0.45
Which agreement was labeled by the Nazis as unfair to Germany?,11,52,0,0,1,0,0,11,1,0,5.907272727,1,0,1,-6.571283042,0.003270452,-0.5,1
Which number would more than 2 times 4 84 ? ( Thanks in advance !),12,52,0,0,0,0,0,4,3,0,-0.59,4,0,0,-2.296603021,0.226233875,0.375,0.35
a. bays  or  d. wetlands,5,18,0,0,0,0,1,1.666666667,3,0,-5.524666667,2,0,0,-6.907755279,0.000981005,0,0
Umbilical cord blood is a rich source of stem cells. Which possible advance in biology would most likely be a result of performing research with an individualí¢ä‰åä‹¢s banked cord blood? ,31,157,0,0,0,0,0,10.33333333,3,0,6.071182796,2,0,0,-5.237073741,0.038221789,0.21875,0.8125
which description is represented by a discrete graph ,8,45,0,0,0,0,1,8,1,0,9.06375,0,0,0,-5.896154367,0.004765735,0,0
what is the fraction 2 7 sixty-fourth minus 40 fifty-six,12,47,0,1,0,1,1,12,1,0,2.2325,2,0,0,-3.766069093,0.046462734,-0.1,0.1
if 7 people can play a game and theres 123476 people that cant how much people cant,17,67,0,0,0,1,1,17,1,0,5.632941176,0,0,0,-4.605170186,0.039964491,-0.1,0.3
If x is an integer such that 0,8,23,0,0,0,0,0,8,1,0,-3.88875,0,0,0,-3.552020271,0.025491086,0,0.5
how do pioneer species help develop soil,7,34,0,1,0,1,1,7,1,0,4.947142857,0,0,0,-4.474141924,0.017724562,0,0
"       Agrí€Œ©able colí€ŒÂre !Digne ressentiment í€Œæ ma douleur bien doux!<br /> Je reconnais mon sang í€Œæ ce noble courroux ;<br /> Ma jeunesse revit en cette ardeur si prompte.<br /> &lt;&lt;&gt;&gt;<br /> Svp c'est urgent,<br />                        Merci.",38,198,26,0,0,0,0,9.5,4,0,2.283947368,20,0,0,-4.116447508,0.206405368,0.6,0.9
whta five things did captain olaf need,7,32,2,0,0,0,1,7,1,0,3.601428571,0,0,0,-4.915325114,0.015686954,0,0
how do you do a graph of mean in science,10,31,0,1,0,1,1,10,1,0,-1.829,0,0,0,-4.828313737,0.009224684,-0.3125,0.6875
when you look at a shiny surface what do you see,11,38,0,1,0,2,1,11,1,0,0.340909091,0,0,0,-5.521460918,0.006643656,0,0
searing meat and soups,4,19,0,0,0,0,1,4,1,0,2.9425,0,0,0,-6.620073207,0.001893421,0,0
what is 70+0  and I don't know what It is and does anybody knows,15,50,0,1,0,2,1,15,1,0,1.456,0,0,0,-2.900422094,0.113306026,0,0
Which of the following is not TRUE of federal courts? ,10,44,0,0,0,0,0,5,2,0,1.323,1,0,1,-3.937340813,0.025060531,-0.0875,0.375
Do you think it is wrong that donal trump is winning or it is right,15,53,1,0,0,0,0,15,1,0,2.712,0,0,0,-5.367310238,0.010982365,0.095238095,0.728571429
"A figure has a vertex at (-1, -3). If the figure has line symmetry about the x-axis, what are the coordinates of another vertex of the figure?<br /><br /> A) (-1, 3)<br /> B) (3, 1)<br /> C) (-3, -1)<br /> D) (1, -3)<br />",46,178,6,0,0,1,0,15.33333333,3,0,-0.350072464,41,0,0,-1.805520384,1.227787871,0,0
"Meiosis is different from the process shown because, during meiosis,",10,59,0,0,0,0,0,10,1,0,10.417,2,0,1,-5.149897361,0.011434531,0,0.6
para que sirve la estratrificacion,5,30,3,0,0,0,1,5,1,0,9.33,0,0,0,-4.933674253,0.013192583,0,0
which of the following is not prevent bursitis ,8,39,0,0,0,0,1,8,1,0,5.53125,0,0,0,-4.074541935,0.015580666,0,0.1
"<strong>Hi Everyone!! I haven't been on here in sooo long, like its been almost 2 years since ive been on this site, and I decided to come back bc I need help a a couple í‰Œæw/í‰Œæassignments. I need help ASAP! If you do k12, and your in the 9th grade .. hmu :)</strong><br />",55,223,6,0,0,0,0,11,5,0,0.769090909,16,0,0,-3.39620984,0.324491758,0.15,0.466666667
the walking dead<br /> do you like it ,8,30,1,0,0,0,1,8,1,0,-1.53375,2,0,0,-4.572380363,0.010782819,0,0
What are the following paragraphs in French ,7,37,0,1,0,1,0,7,1,0,6.965714286,0,0,1,-3.999034382,0.017144536,0,0.05
Aí‹Ÿí‹Œ±z í€Œ_zellikleri zamanla yazí‹Œ± diline geí€Œ_ebileceí‹Ÿi sí€Œ_ylenebilir mi?,12,80,7,0,1,0,0,12,1,0,4.5875,1,0,0,-6.907755279,0.003924018,0,0
songs that represent the book the giver,7,33,0,0,0,0,1,7,1,0,4.274285714,0,0,0,-5.991464547,0.004356321,0,0
I keep seeing 11:11 every day and night for quite some time now. Does anyone know what it might means?,21,83,0,0,1,1,0,10.5,2,0,1.762857143,2,0,1,-4.96184513,0.031141256,0,0
How do u control people that are cuckoo....who help people with homework?<br />,14,67,1,1,0,2,0,4.666666667,3,0,0.752619048,7,0,0,-4.27895445,0.032291969,0,0
The math club needs to ,5,18,0,0,0,0,0,5,1,0,-1.974,0,0,1,-5.233778845,0.006479158,0,0
what was your score out of 10,7,23,0,1,0,1,1,7,1,0,-2.454285714,0,0,0,-3.750754858,0.014988743,0,0
what was your score out of 10?,7,24,0,1,1,1,1,7,1,0,-2.454285714,1,0,0,-3.750754858,0.014988743,0,0
What is the equation of the following direct variation?<br /><br /> https://towerroadnm.ignitiaschools.com/media/g_pal_2015/4/img_directvariation_graph7.gif<br /><br /> y = -2x<br /> y = - 1/2 x<br /> y = 2x<br /> y = 1/2 x<br />,42,197,17,1,0,1,0,8.4,5,1,-0.408571429,22,0,0,-3.302861481,0.191962544,0.05,0.25
What distinguishes first class levers from both second and third class levers? <br /><br /> A.<br /> The fulcrum is between the load and effort.<br /> B.<br /> There is a fulcrum on both sides of the load.<br /> C.<br /> Greater effort is required to move the load.<br /> D.<br /> The first class lever is not found in the human body.,62,272,9,1,0,1,0,6.888888889,9,0,-0.057168459,27,0,0,-4.085494947,0.132537467,0.166666667,0.211111111
a 9- kg bag of mangoes for $12,8,23,0,0,0,0,1,8,1,0,-5.06625,1,0,0,-4.305065594,0.026530882,0,0
is it decreasing when -1 1.,6,22,0,0,0,1,1,6,1,0,-2.73,2,0,0,-3.371638579,0.02938029,0,0
which multiplication sentence can be used to calculate the total shaded area shown in the model below?,17,86,0,0,1,0,1,17,1,0,10.62,1,0,0,-4.6623286,0.031250137,0,0.75
is it decreasing when -1 1?<br />,7,27,1,0,0,1,1,3.5,2,0,-4.877142857,4,0,0,-3.371638579,0.02938029,0,0
Who does k12 and is in 9th grade?,8,26,1,1,1,1,0,8,1,0,-2.71125,1,0,1,-5.703782475,0.004304545,0,0
neverí‰Œæmindí‰Œædelete this......,4,33,0,0,0,0,1,4,1,0,2.9425,6,0,0,-6.907755279,0.000490502,0,0
Rob and Mike are on a club swimming team.<br /> They are training for a statewide swimming meet that will be held in the end of summer. The table shows how many hours Rob and Mike spent at practice each week<br /> practice time (in hours). | Swimmer|weekly|Monday-Friday|<br /> Rob. | 35. | 25 Mike. | 30. | 20 Question: write a possible expression to show how many hours Rob and Mike spend at swim practice over a period of 10 weekends . include parentheses and brackets in your expression.<br /> Please help <br /> and thank you,94,433,5,0,0,2,0,9.4,10,0,3.162234043,22,0,0,-3.805597483,0.361279875,0.225,0.525
Who does k12 and is in the 9th grade? I need help w/ a couple assignments and  was wondering if someone could help me?,24,94,1,1,1,1,0,12,2,0,2.42875,2,0,0,-4.245167452,0.055686096,0,0
Suppose the average rainfall in april was less than the average rainfall in may ,14,66,1,0,0,0,0,14,1,0,7.774285714,0,0,0,-5.490689259,0.013448818,-0.155555556,0.288888889
What is your favorite color,5,23,0,1,0,1,0,5,1,0,2.736,0,0,1,-5.203007187,0.004409409,0.5,1
"Elliotts bad is 75 inches long dog during a growth spurt allegro 6 inches before his girl growth spurt he was 5'11"" tall how much shorter is always better than Elliot",31,136,2,0,0,1,0,31,1,0,14.58129032,0,0,0,-4.59612035,0.07134856,-0.0125,0.441666667
 when making a peanut butter and jelly sandwich be sure to,11,47,0,1,0,1,0,11,1,0,4.194545455,0,0,0,-5.564020532,0.009675608,0.5,0.888888889
 when making a peanut butter and jelly sandwich be sure to use,12,50,0,1,0,1,0,12,1,0,4.195,0,0,0,-4.941642423,0.018516458,0.5,0.888888889
Harvey finished typing his research paper but he needed to proceed it before submitting it to the professor,18,90,0,0,0,0,0,18,1,0,11.12,0,0,1,-6.271766512,0.007640161,0,0
